{"advciv":{"default_unit_controller":"native","fallback_policy":"Community Patch AI moves unmoved units after LLM apply.","recommendations":[]},"civ5":{"map":{"coords_note":"grid x,y; Y increases south","height":26,"hex_layout":"odd-r","width":44},"research_tech":"TECH_POTTERY","yields":{"culture":11,"faith":0,"gold":86,"happiness":10,"science":18}},"decision":{"phase":"strategic_decision","player_id":"PLAYER_0","reason":"turn_start","turn":18,"year":-3400},"diplomacy":{"active_deals":[],"available_proposals":[],"legal_trade_inventory":[],"pending_requests":[],"private_inbox":[],"relations":[]},"game":{"calendar_id":"CALENDAR_DEFAULT","climate_id":"CLIMATE_TEMPERATE","difficulty_id":"HANDICAP_PRINCE","era_id":"ERA_ANCIENT","game_speed_id":"GAMESPEED_STANDARD","map_height":26,"map_script":"Continents","map_width":44,"max_turns":null,"network_multiplayer":false,"options":[],"sea_level_id":"SEALEVEL_MEDIUM","start_era_id":"ERA_ANCIENT","victory_ids":[],"world_size_id":"WORLDSIZE_STANDARD","wrap_x":false,"wrap_y":false},"history":{"accepted_decisions":[],"command_results":[],"diplomacy_events":[],"memory_summary":"Expand to third city after Pottery; scout eastern coast.","public_events":[]},"known_map":{"areas":[],"format":"plot-grid-v1","frontiers":[],"image":{"attached":false,"format":"png-grid-v1","height":26,"label_ids":[],"legend":[],"width":44},"plots":[],"visibility_mode":"player_visible","visible_stacks":[]},"known_other_cities":[],"known_players":[{"civilization_id":"CIVILIZATION_EGYPT","known_capital_city_id":null,"known_civic_ids":[],"known_religion_id":null,"known_tech_ids":[],"land":null,"leader_id":"LEADER_CLEOPATRA","leader_name":"Cleopatra","player_id":"PLAYER_1","population":null,"power":null,"relation":{"at_war":false,"attitude_id":"ATTITUDE_CAUTIOUS","attitude_value":0,"defensive_pact":false,"met":true,"open_borders":false,"vassal":false},"score":138,"team_id":"TEAM_1"}],"legal_commands":[{"affected_ids":["CITY_ATHENS"],"command_id":"CMD_athens_prod_settler","description":"Queue settler in Athens","fixed_arguments":{"build_id":"UNIT_SETTLER","city_id":"CITY_ATHENS"},"kind":"queue_production","parameter_domains":{},"runtime_status":"tested"},{"affected_ids":["CITY_ATHENS"],"command_id":"CMD_athens_prod_monument","description":"Queue monument in Athens","fixed_arguments":{"build_id":"BUILDING_MONUMENT","city_id":"CITY_ATHENS"},"kind":"queue_production","parameter_domains":{},"runtime_status":"tested"},{"affected_ids":["UNIT_SPEARMAN_1"],"command_id":"CMD_spearman_fortify","description":"Fortify spearman","fixed_arguments":{"unit_id":"UNIT_SPEARMAN_1"},"kind":"unit_posture_fortify","parameter_domains":{},"runtime_status":"tested"},{"affected_ids":["UNIT_SPEARMAN_1"],"command_id":"CMD_spearman_skip","description":"Skip spearman","fixed_arguments":{"unit_id":"UNIT_SPEARMAN_1"},"kind":"unit_skip","parameter_domains":{},"runtime_status":"tested"},{"affected_ids":["TECH_POTTERY"],"command_id":"CMD_research_tech_pottery","description":"Research pottery","fixed_arguments":{"tech_id":"TECH_POTTERY"},"kind":"set_research_tech","parameter_domains":{},"runtime_status":"tested"}],"personality":{"civilization_id":"CIVILIZATION_GREECE","identity":"Alexander","leader_id":"LEADER_ALEXANDER","leader_name":"Alexander"},"schema_version":"civ5ai-input/1","strategic_summary":{"city_alerts":[],"diplomacy_alerts":[],"economy_alerts":[],"military_alerts":[{"affected_ids":[],"kind":"ALERT_MILITARY","severity":"info","text":"Barbarian scout spotted east of Corinth"}],"ratios":[],"resource_alerts":[]},"visible_other_units":[],"your_cities":[{"area_id":"AREA_0","automation":{"citizens":false,"production":true},"buildings":[],"city_id":"CITY_ATHENS","commerce":{"culture":{"percent":0,"rate":0},"espionage":{"percent":0,"rate":0},"gold":{"percent":0,"rate":0},"research":{"percent":0,"rate":0}},"corporations":[],"culture":{"change_per_turn":0,"current":0,"maximum":0},"defense":{"bombard_damage":0,"percent":0},"food":{"change_per_turn":0,"current":0,"maximum":0},"garrison_unit_ids":[],"great_people":{"change_per_turn":0,"current":0,"maximum":0},"happiness":{"negative":0,"net":0,"positive":0},"health":{"negative":0,"net":0,"positive":0},"is_capital":true,"is_coastal":false,"maintenance":0,"name":"Athens","occupation_turns":0,"plot_id":"PLOT_15_23","population":4,"production":{"cost":0,"estimated_turns_remaining":null,"item_id":"UNIT_SPEARMAN","production_per_turn":0,"progress":0},"production_queue":[],"religions":[],"specialists":[],"trade_routes":[],"worked_plot_ids":[],"yields":{"commerce":0,"food":0,"production":0}},{"area_id":"AREA_0","automation":{"citizens":false,"production":true},"buildings":[],"city_id":"CITY_CORINTH","commerce":{"culture":{"percent":0,"rate":0},"espionage":{"percent":0,"rate":0},"gold":{"percent":0,"rate":0},"research":{"percent":0,"rate":0}},"corporations":[],"culture":{"change_per_turn":0,"current":0,"maximum":0},"defense":{"bombard_damage":0,"percent":0},"food":{"change_per_turn":0,"current":0,"maximum":0},"garrison_unit_ids":[],"great_people":{"change_per_turn":0,"current":0,"maximum":0},"happiness":{"negative":0,"net":0,"positive":0},"health":{"negative":0,"net":0,"positive":0},"is_capital":false,"is_coastal":false,"maintenance":0,"name":"Corinth","occupation_turns":0,"plot_id":"PLOT_16_24","population":3,"production":{"cost":0,"estimated_turns_remaining":null,"item_id":"BUILDING_GRANARY","production_per_turn":0,"progress":0},"production_queue":[],"religions":[],"specialists":[],"trade_routes":[],"worked_plot_ids":[],"yields":{"commerce":0,"food":0,"production":0}}],"your_empire":{"anarchy_turns":0,"civics":[],"commerce":{"culture":{"percent":0,"rate":11},"espionage":{"percent":0,"rate":0},"gold":{"percent":0,"rate":12},"research":{"percent":100,"rate":18}},"costs":{"city_maintenance":0,"civic_upkeep":0,"inflation":0,"unit_cost":0,"unit_supply":0},"gold":86,"gold_per_turn":12,"golden_age_turns":0,"religion":{"conversion_timer":0,"convertible_religion_ids":[],"state_religion_id":null},"research":{"cost":25,"estimated_turns_remaining":2,"known_tech_ids":[],"progress":4,"queue":[],"research_per_turn":18,"tech_id":"TECH_POTTERY"},"resources":[],"score":142,"team_id":"TEAM_0","unit_counts":{"great_people":0,"idle":3,"military":2,"missionaries":0,"settlers":1,"spies":0,"total":5,"upgradeable":0,"workers":0},"victory_progress":[],"war_weariness":0},"your_units":[{"activity_id":"ACTIVITY_UNKNOWN","can_act":true,"cargo_unit_ids":[],"domain_id":"DOMAIN_LAND","experience":0,"health":{"change_per_turn":0,"current":100,"maximum":100},"level":1,"mission_queue":[],"movement":{"change_per_turn":0,"current":2,"maximum":2},"needs_orders":true,"plot_id":"PLOT_14_22","promotion_ids":[],"strength":{"change_per_turn":0,"current":0,"maximum":0},"unit_ai_role":"UNITAI_UNKNOWN","unit_class_id":"UNITCLASS_UNKNOWN","unit_id":"UNIT_SCOUT_1","unit_type_id":"UNIT_SCOUT","upgrade_options":[]},{"activity_id":"ACTIVITY_UNKNOWN","can_act":true,"cargo_unit_ids":[],"domain_id":"DOMAIN_LAND","experience":0,"health":{"change_per_turn":0,"current":100,"maximum":100},"level":1,"mission_queue":[],"movement":{"change_per_turn":0,"current":2,"maximum":2},"needs_orders":true,"plot_id":"PLOT_16_24","promotion_ids":[],"strength":{"change_per_turn":0,"current":0,"maximum":0},"unit_ai_role":"UNITAI_UNKNOWN","unit_class_id":"UNITCLASS_UNKNOWN","unit_id":"UNIT_SETTLER_1","unit_type_id":"UNIT_SETTLER","upgrade_options":[]},{"activity_id":"ACTIVITY_UNKNOWN","can_act":true,"cargo_unit_ids":[],"domain_id":"DOMAIN_LAND","experience":0,"health":{"change_per_turn":0,"current":100,"maximum":100},"level":1,"mission_queue":[],"movement":{"change_per_turn":0,"current":2,"maximum":2},"needs_orders":true,"plot_id":"PLOT_15_23","promotion_ids":[],"strength":{"change_per_turn":0,"current":0,"maximum":0},"unit_ai_role":"UNITAI_UNKNOWN","unit_class_id":"UNITCLASS_UNKNOWN","unit_id":"UNIT_SPEARMAN_1","unit_type_id":"UNIT_SPEARMAN","upgrade_options":[]}]}
